
root@comp3134-101070231:~# tcpdump -c 5 -i eth0
tcpdump: verbose output suppressed, use -v or -vv for full protocol decode
listening on eth0, link-type EN10MB (Ethernet), capture size 262144 bytes
16:36:58.737959 IP 162.243.188.66.12155 > comp3134-101070231.ssh: Flags [.], ack 1883479544, win 501, options [nop,nop,TS val 2156483493 ecr 3381965173], length 0
16:36:58.742853 IP comp3134-101070231.ssh > 162.243.188.66.12155: Flags [P.], seq 1:129, ack 0, win 502, options [nop,nop,TS val 3381965189 ecr 2156483493], length 128
16:36:58.743017 IP comp3134-101070231.ssh > 162.243.188.66.12155: Flags [P.], seq 129:193, ack 0, win 502, options [nop,nop,TS val 3381965189 ecr 2156483493], length 64
16:36:58.743181 IP comp3134-101070231.ssh > 162.243.188.66.12155: Flags [P.], seq 193:321, ack 0, win 502, options [nop,nop,TS val 3381965189 ecr 2156483493], length 128
16:36:58.743312 IP comp3134-101070231.ssh > 162.243.188.66.12155: Flags [P.], seq 321:385, ack 0, win 502, options [nop,nop,TS val 3381965190 ecr 2156483493], length 64
5 packets captured
35 packets received by filter
1 packet dropped by kernel
