root@comp3134-101070231:~# tcpdump -i eth0 -c 30
tcpdump: verbose output suppressed, use -v or -vv for full protocol decode
listening on eth0, link-type EN10MB (Ethernet), capture size 262144 bytes
16:35:22.196355 IP 162.243.188.66.12155 > comp3134-101070231.ssh: Flags [.], ack 1883471192, win 501, options [nop,nop,TS val 2156386952 ecr 3381868631], length 0
16:35:22.197968 IP comp3134-101070231.ssh > 162.243.188.66.12155: Flags [P.], seq 1:129, ack 0, win 502, options [nop,nop,TS val 3381868644 ecr 2156386952], length 128
16:35:22.198099 IP comp3134-101070231.ssh > 162.243.188.66.12155: Flags [P.], seq 129:193, ack 0, win 502, options [nop,nop,TS val 3381868644 ecr 2156386952], length 64
16:35:22.198222 IP comp3134-101070231.ssh > 162.243.188.66.12155: Flags [P.], seq 193:321, ack 0, win 502, options [nop,nop,TS val 3381868645 ecr 2156386952], length 128
16:35:22.198318 IP comp3134-101070231.ssh > 162.243.188.66.12155: Flags [P.], seq 321:385, ack 0, win 502, options [nop,nop,TS val 3381868645 ecr 2156386952], length 64
16:35:22.199579 IP comp3134-101070231.57880 > 67.207.67.2.domain: 54957+ [1au] PTR? 11.13.203.159.in-addr.arpa. (55)
16:35:22.199721 IP comp3134-101070231.55119 > 67.207.67.2.domain: 56840+ [1au] PTR? 11.13.203.159.in-addr.arpa. (55)
16:35:22.199813 IP comp3134-101070231.36269 > 67.207.67.2.domain: 15374+ [1au] PTR? 11.13.203.159.in-addr.arpa. (55)
16:35:22.201205 IP 67.207.67.2.domain > comp3134-101070231.57880: 54957 NXDomain 0/1/1 (122)
16:35:22.201271 IP 67.207.67.2.domain > comp3134-101070231.55119: 56840 NXDomain 0/1/1 (122)
16:35:22.201500 IP comp3134-101070231.57880 > 67.207.67.2.domain: 54957+ PTR? 11.13.203.159.in-addr.arpa. (44)
16:35:22.201655 IP comp3134-101070231.55119 > 67.207.67.2.domain: 56840+ PTR? 11.13.203.159.in-addr.arpa. (44)
16:35:22.201894 IP 67.207.67.2.domain > comp3134-101070231.57880: 54957 NXDomain 0/1/0 (111)
16:35:22.202186 IP 67.207.67.2.domain > comp3134-101070231.55119: 56840 NXDomain 0/1/0 (111)
16:35:22.205630 IP 67.207.67.2.domain > comp3134-101070231.36269: 15374 NXDomain 0/1/1 (122)
16:35:22.205811 IP comp3134-101070231.36269 > 67.207.67.2.domain: 15374+ PTR? 11.13.203.159.in-addr.arpa. (44)
16:35:22.206727 IP 67.207.67.2.domain > comp3134-101070231.36269: 15374 NXDomain 0/1/0 (111)
16:35:22.207857 IP comp3134-101070231.52032 > 67.207.67.2.domain: 26008+ [1au] PTR? 66.188.243.162.in-addr.arpa. (56)
16:35:22.207988 IP comp3134-101070231.54330 > 67.207.67.2.domain: 32887+ [1au] PTR? 66.188.243.162.in-addr.arpa. (56)
16:35:22.208115 IP comp3134-101070231.53403 > 67.207.67.2.domain: 15104+ [1au] PTR? 66.188.243.162.in-addr.arpa. (56)
16:35:22.208489 IP 67.207.67.2.domain > comp3134-101070231.54330: 32887 NXDomain 0/1/1 (123)
16:35:22.208537 IP 67.207.67.2.domain > comp3134-101070231.52032: 26008 NXDomain 0/1/1 (123)
16:35:22.208690 IP comp3134-101070231.54330 > 67.207.67.2.domain: 32887+ PTR? 66.188.243.162.in-addr.arpa. (45)
16:35:22.208772 IP 67.207.67.2.domain > comp3134-101070231.53403: 15104 NXDomain 0/1/1 (123)
16:35:22.209011 IP 67.207.67.2.domain > comp3134-101070231.54330: 32887 NXDomain 0/1/0 (112)
16:35:22.209065 IP comp3134-101070231.52032 > 67.207.67.2.domain: 26008+ PTR? 66.188.243.162.in-addr.arpa. (45)
16:35:22.209254 IP 162.243.188.66.12155 > comp3134-101070231.ssh: Flags [.], ack 129, win 501, options [nop,nop,TS val 2156386965 ecr 3381868644], length 0
16:35:22.209292 IP 162.243.188.66.12155 > comp3134-101070231.ssh: Flags [.], ack 193, win 501, options [nop,nop,TS val 2156386965 ecr 3381868644], length 0
16:35:22.209303 IP comp3134-101070231.53403 > 67.207.67.2.domain: 15104+ PTR? 66.188.243.162.in-addr.arpa. (45)
16:35:22.209391 IP 162.243.188.66.12155 > comp3134-101070231.ssh: Flags [.], ack 321, win 501, options [nop,nop,TS val 2156386965 ecr 3381868645], length 0
30 packets captured
55 packets received by filter
18 packets dropped by kernel
root@comp3134-101070231:~# ^C
root@comp3134-101070231:~# 
